{
  "$schema": "https://json-schema.org/draft/2020-12/schema",
  "$id": "task-execution-profile.schema.json",
  "title": "TaskExecutionProfile",
  "type": "object",
  "additionalProperties": false,
  "required": [
    "task_type",
    "role_id",
    "required_capabilities",
    "preferred_capabilities",
    "routing_policy_patch"
  ],
  "properties": {
    "task_type": { "type": "string" },
    "role_id": { "type": "string" },
    "required_capabilities": { "type": "array", "items": { "type": "string" } },
    "preferred_capabilities": { "type": "array", "items": { "type": "string" } },
    "routing_policy_patch": { "$ref": "./routing-policy.schema.json" }
  }
}
